{
  "registryName": "Mu Changke Fiction Editorial Registry",
  "registryVersion": "1.0",
  "author": "牧长客",
  "works": [
    {
      "canonicalTitle": "以诺：长生纪元",
      "slug": "enoch-longevity-era",
      "workType": "fiction",
      "collection": "mu-changke-fiction",
      "cover": "mu-changke-fiction-canonical-package-v1-final/covers/assets/01-enoch.jpeg",
      "editorialHook": "在一个人人追逐长寿、力量与答案的时代，一个被判定只能活到五十岁的少年，却从一块被遗忘的石碑开始，重新追问：人真正应该延长的，究竟是寿命，还是一条值得有人继续走下去的路？",
      "rightsSafeIntroduction": "《以诺：长生纪元》从一个残酷的反差开始：在长寿成为秩序、能力成为尺度的世界里，牧川偏偏是那个“无轮”的人。被判定短命、被排除在共同体的期待之外，他却在旧祖祠里遇见一个被抹去的名字，由此踏上一条不断改写自己对生命、强弱、记忆与拯救理解的道路。\n\n小说借长生世界的奇幻外壳，追问的并不只是“怎样活得更久”。它更关心：当所有人都想得到更多寿命、力量和答案时，谁还愿意记住被遗忘的人？谁愿意接住别人没有走完的路？一个人的价值，究竟由寿轮、强弱与被承认的程度决定，还是由他如何回应所领受的生命决定？\n\n这是一部关于长生的小说，也是一部不断逼近死亡、名字、责任与同行的小说。它不急着给出简单答案，而让牧川在一次次选择中学习：并不是所有人都等着被他救，有些道路真正需要的，是有人愿意记得、承接，并继续往前走。",
      "themes": [
        "生命与长寿",
        "身份与价值",
        "名字与记忆",
        "强弱与衡量",
        "死亡与承接",
        "同行与责任",
        "拯救欲与界限",
        "遗忘与守望"
      ],
      "whyRead": "如果你喜欢有完整世界观的成长型奇幻，却又希望故事不只停留在升级、力量和胜负，《以诺：长生纪元》提供的是另一种阅读方向。它把“长生”从愿望变成问题，把“强大”从答案变成需要被审视的尺度，也让一个最初因短命而羞耻的少年，逐渐面对比自己能活多久更大的事情。\n\n真正吸引人的地方，不只是牧川会遇见什么，而是他会成为什么样的人：当他越来越有能力介入别人的命运，他也必须学习什么时候伸手、什么时候停下，以及如何不把别人变成自己成长故事里的工具。",
      "readingExperience": "从“短命者”切入长生世界，开篇反差强烈。\n世界观、谜团与人物成长同步推进。\n石碑、名字、灯、道路等意象在后段逐渐形成结构性呼应。\n奇幻冒险之外保留伦理与生命问题的持续张力。\n适合喜欢慢慢发现世界规则、人物关系与深层主题的读者。",
      "biblicalCulturalNote": "书名“以诺”以及“三百六十五年”等意象与《创世记》中以诺的记载形成明确文化与圣经共鸣。但本作不是对圣经人物生平的改写，也不应被当作经文释义。小说借这一名称与“长生”母题展开文学性的想象，进一步讨论生命、同行、死亡、记忆与人的价值。",
      "authorCreativeNote": "这部作品把“人为什么想活得更久”作为世界观入口，却逐渐把问题转向“人为什么而活，以及一个人离开之后有什么值得被接住”。因此，长生不是终点，而是一面镜子：它照见人对力量、控制、答案和不肯失去的自己所怀的渴望，也照见记名、守路、同行与承接这些更安静的价值。",
      "publicationNote": "本页为作者个人网站的作品档案与原创编辑性介绍，不提供小说正文、章节连载或下载。作品的正式阅读与发行以授权平台所提供的版本为准。",
      "officialReadingCTA": "请在番茄小说或今日头条搜索《以诺：长生纪元》，作者：牧长客。",
      "rightsStatus": "AUTHOR_PORTFOLIO_EDITORIAL_DISCOVERY_LAYER",
      "editorialVersion": "AUTHOR_APPROVED_CANONICAL_RECOVERY_EDITION_v1.0",
      "editorialStatus": "LOCKED"
    },
    {
      "canonicalTitle": "逃到旷野的人",
      "slug": "escape-wilderness",
      "workType": "fiction",
      "collection": "mu-changke-fiction",
      "cover": "mu-changke-fiction-canonical-package-v1-final/covers/assets/02-escape-wilderness.jpeg",
      "editorialHook": "当所有声音都在告诉你“都是你的错”，逃离人群，究竟是逃避，还是重新听见真实的开始？",
      "rightsSafeIntroduction": "林远是一名在烈火与死亡之间工作多年的消防救援站长。\n\n一次救援事故之后，他曾经坚信的职业、荣誉和自我认知开始崩塌。舆论的审判、失去同伴的痛苦，以及内心不断重复的一个声音，把他一步步推向人与世界的边缘。\n\n于是，他走进旷野。\n\n然而真正需要面对的，并不是山林里的孤独，而是那个已经住进心里的声音：\n\n**“都是你的错。”**\n\n《逃到旷野的人》写创伤，也写罪疚；写现代舆论如何塑造一个人的自我认识，更写人在所有外界声音沉寂以后，如何重新分辨什么是真实。",
      "themes": [
        "罪疚与自责",
        "创伤与修复",
        "舆论审判",
        "身份认同",
        "旷野",
        "真理与谎言"
      ],
      "whyRead": "因为它追问一个许多人都曾经历的问题：\n\n**如果一个错误、一场失败、一次无法挽回的失去，开始定义你整个人生，你还能不能重新认识自己？**",
      "readingExperience": "心理现实\n都市创伤\n属灵寓言\nIWU",
      "biblicalCulturalNote": "作品借用了“旷野”与以利亚式的精神意象，但不是圣经故事改写。旷野在这里既是逃离，也是重新分辨声音的地方。",
      "authorCreativeNote": null,
      "publicationNote": "本页为作者个人网站的作品档案与原创编辑性介绍，不提供小说正文、章节连载或下载。作品的正式阅读与发行以授权平台所提供的版本为准。",
      "officialReadingCTA": "在番茄小说或今日头条搜索：\n\n**《逃到旷野的人》**  \n**作者：牧长客**\n\n**前往官方平台阅读 →**",
      "rightsStatus": "AUTHOR_PORTFOLIO_EDITORIAL_DISCOVERY_LAYER",
      "editorialVersion": "v1.0",
      "editorialStatus": "LOCKED"
    },
    {
      "canonicalTitle": "乌鸦每天都会来",
      "slug": "ravens-every-day",
      "workType": "fiction",
      "collection": "mu-changke-fiction",
      "cover": "mu-changke-fiction-canonical-package-v1-final/covers/assets/03-ravens-every-day.jpeg",
      "editorialHook": "当一个人只剩二十七块六毛钱，他最需要的，究竟是一场奇迹，还是明天仍然有人来敲门？",
      "rightsSafeIntroduction": "三十五岁的陈默曾经以为，只要足够努力，就能在城市里换来一个稳定的位置。\n\n十二年以后，他被“降本增效”推出公司。房贷、车贷、父亲的医疗费用、女儿的抚养费，却没有因为失业而停止。\n\n当一个成年人所有的安全感都被数字一点点抽空，一份来源不明的食物开始每天准时出现。\n\n谁送来的？\n\n为什么帮助他？\n\n这一切背后究竟隐藏着什么？\n\n《乌鸦每天都会来》从现代都市最真实的生存焦虑出发，却没有停留在贫穷与失业。它最终追问的是：\n\n**当一个人觉得自己已经被世界遗弃时，还有没有一种供应，是他暂时看不见的？**",
      "themes": [
        "失业",
        "尊严",
        "匮乏",
        "供应",
        "孤独",
        "希望",
        "看不见的连接"
      ],
      "whyRead": "这不是一个简单的“绝境翻身”故事。\n\n小说真正关心的是：当一个人被工作、债务和生活一点点推向边缘，当他甚至开始怀疑自己是否仍值得被这个世界留下，还有什么能够重新把他与生活连接起来？\n\n《乌鸦每天都会来》把一个古老的“供应”意象放进现代都市最普通的门口，却把答案留给读者自己去发现。",
      "readingExperience": "都市现实\n温情悬疑\n社会寓言\n希望文学",
      "biblicalCulturalNote": "“乌鸦”自然让人联想到旷野中的以利亚与隐秘供应，但小说把这个古老意象重新放进现代城市、外卖、程序和人与人之间看不见的连接之中。",
      "authorCreativeNote": null,
      "publicationNote": "本页为作者个人网站的作品档案与原创编辑性介绍，不提供小说正文、章节连载或下载。作品的正式阅读与发行以授权平台所提供的版本为准。",
      "officialReadingCTA": "在番茄小说或今日头条搜索：\n\n**《乌鸦每天都会来》**  \n**作者：牧长客**\n\n**前往官方平台阅读 →**",
      "rightsStatus": "AUTHOR_PORTFOLIO_EDITORIAL_DISCOVERY_LAYER",
      "editorialVersion": "v1.1",
      "editorialStatus": "LOCKED"
    },
    {
      "canonicalTitle": "山洞里的声音",
      "slug": "voice-in-the-cave",
      "workType": "fiction",
      "collection": "mu-changke-fiction",
      "cover": "mu-changke-fiction-canonical-package-v1-final/covers/assets/04-voice-in-the-cave.jpeg",
      "editorialHook": "当烈风、地震和烈火都在告诉你必须马上成功，你还能听见那个微小而真实的声音吗？",
      "rightsSafeIntroduction": "周启航生活在一个永远不会安静的时代。\n\n手机、短视频、成功学、创业故事、财富神话、算法推荐……每一个声音都在告诉他：\n\n别人已经成功了。  \n你正在落后。  \n你必须马上改变命运。\n\n当现实压力越来越大，一个看似能够“破局”的机会出现。\n\n可是，人最危险的时候，也许并不是没有路，而是太急于相信任何一条看起来能够立即出去的路。\n\n《山洞里的声音》把现代人的焦虑、财富欲望和算法时代的信息轰炸压缩进一个人的精神危机：\n\n**当世界越来越响，人怎样重新听见真实？**",
      "themes": [
        "焦虑",
        "成功学",
        "财富诱惑",
        "信息噪音",
        "恐惧",
        "欲望",
        "分辨"
      ],
      "whyRead": "如果你曾经刷着手机，突然觉得所有人都比自己成功；如果你曾经因为害怕落后而急于作出决定，这个故事可能会让你认出一种非常熟悉的声音。",
      "readingExperience": "心理悬疑\n都市焦虑\n财经诱惑\n圣经文化寓言",
      "biblicalCulturalNote": "作品明显借用了以利亚在何烈山经历烈风、地震、火与“微小声音”的文化结构，但把战场移到了手机屏幕、算法、投资焦虑和现代人的内心。",
      "authorCreativeNote": null,
      "publicationNote": "本页为作者个人网站的作品档案与原创编辑性介绍，不提供小说正文、章节连载或下载。作品的正式阅读与发行以授权平台所提供的版本为准。",
      "officialReadingCTA": "在番茄小说或今日头条搜索：\n\n**《山洞里的声音》**  \n**作者：牧长客**\n\n**前往官方平台阅读 →**",
      "rightsStatus": "AUTHOR_PORTFOLIO_EDITORIAL_DISCOVERY_LAYER",
      "editorialVersion": "v1.0",
      "editorialStatus": "LOCKED"
    },
    {
      "canonicalTitle": "最后一块饼",
      "slug": "last-cake",
      "workType": "fiction",
      "collection": "mu-changke-fiction",
      "cover": "mu-changke-fiction-canonical-package-v1-final/covers/assets/05-last-cake.jpeg",
      "editorialHook": "当你手里只剩最后一点东西，恐惧会告诉你抓紧它；爱却可能问你：还愿不愿意分出去？",
      "rightsSafeIntroduction": "凌晨四点四十五分，林晓静醒来。\n\n银行账户里的余额已经不足以覆盖接下来生活最基本的需要。房租、孩子、食物、交通，每一个数字都在逼迫她计算下一步。\n\n贫穷最残酷的地方，并不只是“没有钱”。\n\n它会逐渐改变一个人看世界的方式——让每一份给予都像损失，让每一个陌生人都可能成为威胁，让“我必须先保护自己”变成唯一合理的选择。\n\n《最后一块饼》把一个古老的信心问题放进现代城市最具体的匮乏中：\n\n**当自己也不够的时候，人还能不能给予？**",
      "themes": [
        "匮乏",
        "单亲母亲",
        "恐惧",
        "给予",
        "尊严",
        "信任",
        "丰盛"
      ],
      "whyRead": "因为真正的贫穷不仅发生在钱包里。\n\n这个故事更关心的是：**匮乏会不会最终住进人的心里？**",
      "readingExperience": "底层现实\n家庭困境\n温情文学\n信心寓言",
      "biblicalCulturalNote": "标题带有明显的“最后一点面与油”“最后一块饼”式圣经文化共鸣，但故事被完全置入现代城市的经济压力与普通人的生活选择之中。",
      "authorCreativeNote": null,
      "publicationNote": "本页为作者个人网站的作品档案与原创编辑性介绍，不提供小说正文、章节连载或下载。作品的正式阅读与发行以授权平台所提供的版本为准。",
      "officialReadingCTA": "在番茄小说或今日头条搜索：\n\n**《最后一块饼》**  \n**作者：牧长客**\n\n**前往官方平台阅读 →**",
      "rightsStatus": "AUTHOR_PORTFOLIO_EDITORIAL_DISCOVERY_LAYER",
      "editorialVersion": "v1.0",
      "editorialStatus": "LOCKED"
    },
    {
      "canonicalTitle": "火没有降下来",
      "slug": "fire-did-not-fall",
      "workType": "fiction",
      "collection": "mu-changke-fiction",
      "cover": "mu-changke-fiction-canonical-package-v1-final/covers/assets/06-fire-did-not-fall.jpeg",
      "editorialHook": "当所有人都在等待一场爆红证明自己的价值，他最终发现：火不一定要降下来，光仍然可以留下。",
      "rightsSafeIntroduction": "陈烈相信内容应该有品质。\n\n三年、一千多个日夜、两百多支视频，他认真对待每一个镜头，却始终等不到算法的回应。\n\n当越来越粗糙、夸张甚至虚假的内容一次次获得掌声，他开始怀疑：坚持真实，到底还有没有意义？\n\n从渴望被看见，到试图制造“被看见”；从相信作品，到开始相信流量；一个创作者渐渐站在自己的“巴力祭坛”前，等待那场足以证明自己的火。\n\n**《火没有降下来》**写的不只是短视频时代，而是一个更普遍的困境：\n\n**如果掌声迟迟不来，我们是否仍愿意忠于那些真正有价值的事？**",
      "themes": [
        "流量与价值",
        "真实与表演",
        "成功与忠心",
        "算法与注意力",
        "陪伴与微光"
      ],
      "whyRead": "这不是一篇简单批判短视频和流量时代的小说。\n\n陈烈真正面对的敌人，并不只是算法，而是一个越来越熟悉的声音：\n\n**“如果没有人看见，你做的一切就没有意义。”**\n\n这也是许多创作者、工作者甚至普通人在今天面对的问题。\n\n小说最有力量的地方，不在于告诉读者怎样获得更多流量，而在于重新提出一个更难的问题：\n\n**当数字不能证明你时，你靠什么确认自己的价值？**",
      "readingExperience": "都市现实\n创作者困境\n流量时代\n算法文化\n信仰寓言\n温暖救赎",
      "biblicalCulturalNote": "小说以“巴力的祭坛”和“火”等圣经文化意象构成深层隐喻，但并非对圣经故事的现代复述。\n\n古老的“等待火降下来”，在作品中被重新放进算法与注意力经济的世界：当流量逐渐成为证明价值的“火”，一个人还能否在没有轰动、没有掌声的时候继续忠于真实？",
      "authorCreativeNote": null,
      "publicationNote": "《火没有降下来》为牧长客创作的签约小说；本网站作品介绍以作者确认的**第三版（v3）**为编辑依据。\n\n本网站仅作为作者官方作品档案，提供原创编辑介绍、作品信息与阅读指引，不提供小说正文、章节转载或下载。\n\n完整作品请通过正式授权平台阅读。",
      "officialReadingCTA": "**火没有降下来，故事却没有结束。**\n\n在番茄小说或今日头条搜索：\n\n**《火没有降下来》**  \n**作者：牧长客**\n\n**前往官方平台阅读 →**",
      "rightsStatus": "AUTHOR_PORTFOLIO_EDITORIAL_DISCOVERY_LAYER",
      "editorialVersion": "v1.0",
      "editorialStatus": "LOCKED"
    },
    {
      "canonicalTitle": "一直没有下雨",
      "slug": "no-rain",
      "workType": "fiction",
      "collection": "mu-changke-fiction",
      "cover": "mu-changke-fiction-canonical-package-v1-final/covers/assets/07-no-rain.jpeg",
      "editorialHook": "如果六次抬头都是晴空，第七次，你还会不会继续抬头？",
      "rightsSafeIntroduction": "陆远用了三年时间做一件越来越没有人相信的事情。\n\n员工离开，资金枯竭，投资人失去耐心，朋友劝他认输。这个崇尚速度、风口和即时回报的时代不断给出同一个结论：\n\n**没有立刻成功，就是失败。**\n\n可是，有些事情真正需要的并不是更快，而是更深。\n\n《一直没有下雨》写创业，却不是一篇创业成功学；写坚持，却拒绝把坚持浪漫化。\n\n它真正追问的是：\n\n**一个人怎样分辨，自己是在忠心等待，还是只是不肯承认失败？**",
      "themes": [
        "等待",
        "创业",
        "坚持",
        "延迟回报",
        "信念",
        "成败",
        "时间"
      ],
      "whyRead": "因为这个时代非常擅长教人开始，却不太知道怎样面对长期没有结果的日子。\n\n而人生许多真正重要的事情，都发生在那里。",
      "readingExperience": "创业现实\n长期主义\n信念文学\n现代寓言",
      "biblicalCulturalNote": "作品借用了长期干旱、不断观看天际、最终等候雨来的以利亚传统意象，但核心不是“坚持就一定成功”，而是人在长期等待中如何面对自己的动机与信念。",
      "authorCreativeNote": null,
      "publicationNote": "本页为作者个人网站的作品档案与原创编辑性介绍，不提供小说正文、章节连载或下载。作品的正式阅读与发行以授权平台所提供的版本为准。",